{
  "schema_version": 1,
  "hub_manifest_url": "https://artifacts.example.com/federation/hub-v1.json",
  "hub_manifest_sha256": "ad1979a57eef3cb36fd5a804fb781d71e0b4fec80d300b9eb8a700d0f21b7a8c",
  "refresh_after_seconds": 300,
  "max_manifest_bytes": 4194304,
  "max_shards": 10000,
  "failure_mode": "last-known-good-or-unavailable"
}
